{
  "$schema": "http://json-schema.org/draft-07/schema#",
  "type": "object",
  "properties": {
    "id": {
      "type": "string",
      "minLength": 1,
      "pattern": "^[a-z0-9][a-z0-9-]*$"
    },
    "langCode": {
      "type": "string",
      "minLength": 2
    },
    "name": {
      "type": "string",
      "minLength": 1
    },
    "englishName": {
      "type": "string",
      "minLength": 1
    },
    "description": {
      "type": "string",
      "minLength": 1
    },
    "direction": {
      "default": "ltr",
      "type": "string",
      "enum": [
        "ltr",
        "rtl"
      ]
    },
    "attribution": {
      "type": "string"
    },
    "transliteration": {
      "type": "object",
      "properties": {
        "scheme": {
          "type": "string",
          "minLength": 1
        },
        "required": {
          "default": true,
          "type": "boolean"
        }
      },
      "required": [
        "scheme"
      ],
      "additionalProperties": false
    },
    "formLabels": {
      "default": {},
      "type": "object",
      "propertyNames": {
        "type": "string"
      },
      "additionalProperties": {
        "type": "array",
        "items": {
          "type": "object",
          "properties": {
            "key": {
              "type": "string",
              "minLength": 1
            },
            "label": {
              "type": "string",
              "minLength": 1
            }
          },
          "required": [
            "key",
            "label"
          ],
          "additionalProperties": false
        }
      }
    },
    "levels": {
      "minItems": 1,
      "type": "array",
      "items": {
        "type": "string",
        "enum": [
          "A1",
          "A2",
          "B1",
          "B2",
          "C1",
          "C2"
        ]
      }
    }
  },
  "required": [
    "id",
    "langCode",
    "name",
    "englishName",
    "description",
    "levels"
  ],
  "additionalProperties": false
}
